{
  "schema_version": 1,
  "agent_os_version": "9.1.0",
  "release_id": "aos16-v9.1.0-canonical",
  "created_at": "2026-08-17T04:42:11Z",
  "hash_algorithm": "sha256",
  "provenance": {
    "status": "verified-release",
    "source_locator": "https://github.com/pmtriit-91/Universal-Agent-OS.git",
    "source_commit": "340b63407e10f645e38342e40c269e2f2be44eba",
    "created_from_repository_head": "340b63407e10f645e38342e40c269e2f2be44eba"
  },
  "excluded_scopes": [
    "project/**",
    "skills/project-memory/**",
    "skills/project-local/**",
    "_runtime/**",
    "_telemetry/*.jsonl",
    "**/__pycache__/**",
    "**/*.pyc",
    "**/.DS_Store"
  ],
  "vendor_lock": "vendor/vendor-lock.json",
  "entries": [
    {
      "path": ".agentignore",
      "type": "file",
      "sha256": "a6ae1a6671e78e168e1805e8b25a4c76094decbba01f92964e639b2c768930ca"
    },
    {
      "path": ".gitattributes",
      "type": "file",
      "sha256": "5405d85b8b3084381282392d771d106c129173b2fd0b42df6061936489d9c51b"
    },
    {
      "path": "AGENTS.md",
      "type": "file",
      "sha256": "32b533dc2ce217259120691680e6eefa6199b000e80fdd302b83dbbca9da54cc"
    },
    {
      "path": "OS_MAINTENANCE_PROMPTS_VI.md",
      "type": "file",
      "sha256": "69333f89952ee46f5fc3c7ad74c5c8e7effe2128deb86e041d8be06a74c98a8b"
    },
    {
      "path": "README.md",
      "type": "file",
      "sha256": "a3cbba52c860c5a93334e74fdf7c129d36cd90a1c1fc4c30011d929a40b00dc1"
    },
    {
      "path": "THIRD_PARTY_NOTICES.md",
      "type": "file",
      "sha256": "6fdd0c367e4597164d8678db44afa3f842c09e21f42001b3de7d967bc404a385"
    },
    {
      "path": "USER_GUIDE_VI.md",
      "type": "file",
      "sha256": "71a23b22243713841f152f2e17aac6b27a9abdefd084712b76ef74bab1d3eea5"
    },
    {
      "path": "_ide/README.md",
      "type": "file",
      "sha256": "5444dc94006a81ec4803aeeb138a6ecce6f71eed0cbb41a990061b52ad4cef36"
    },
    {
      "path": "_ide/ide-policy.json",
      "type": "file",
      "sha256": "a7e0769be05b194745e8ca47a3e0ab632e58383d58b08140e4b8e0bb8798d0b5"
    },
    {
      "path": "_ide/mcp-specification.md",
      "type": "file",
      "sha256": "2669c6153b3ef847bea2d3c4e1c59e33559fbe474a13e9803f59de1baf985d67"
    },
    {
      "path": "_manifest/CHANGELOG.md",
      "type": "file",
      "sha256": "a6406dfa287d58556bd690e29c62b27190e30993f13a3c26e3fdb804a07ce9e9"
    },
    {
      "path": "_manifest/README.md",
      "type": "file",
      "sha256": "db8e425836c3accd6e92080660774e010a224ef2de8869ee54447f84e4b52c0d"
    },
    {
      "path": "_manifest/legacy/changelog-through-v8.md",
      "type": "file",
      "sha256": "18749ee735177c368e0453393747b179269d3993decfc2ba81f07586d91e31f1"
    },
    {
      "path": "_manifest/legacy/evolution-history-through-v8.md",
      "type": "file",
      "sha256": "69232567a2a8a4c827a907b76e0665e80ca5cdc9ffe2a115fe89131bca942056"
    },
    {
      "path": "_manifest/legacy/history-through-v8.md",
      "type": "file",
      "sha256": "74da2a4ac73fdfccd9b2c939cfd1d114e81bac9b38bc37c7d70c75256c667126"
    },
    {
      "path": "_manifest/legacy/lessons-through-v8.md",
      "type": "file",
      "sha256": "25cfb755caf0bed9fda97377d9a135919c044e346e68e487519310c9776b713b"
    },
    {
      "path": "_manifest/legacy/v8-architecture-report.md",
      "type": "file",
      "sha256": "b02c47573a3f8d939f180306818e581a42565bf48f8535b92e5ddf9461b69d3f"
    },
    {
      "path": "_manifest/legacy/v8-mixed-files-sha256.json",
      "type": "file",
      "sha256": "ecccabaa9bb69562ee5c2db5f3aa74d05424312cff36268580cb7cc8e312662a"
    },
    {
      "path": "_manifest/legacy/v8-private-release-snapshot.json",
      "type": "file",
      "sha256": "b406fed6658b49662c462742e3504bfd5adaf712b2a9b2827033780874fb6d5d"
    },
    {
      "path": "_tools/agent_os_capabilities.py",
      "type": "file",
      "sha256": "71a2817027b30d082a121f43a6e655f7e005c13820434d1f286684e121686677"
    },
    {
      "path": "_tools/agent_os_capability_lifecycle.py",
      "type": "file",
      "sha256": "099a4a34af005877797922e542b74ef95581bd8381452f917dfc46faf717aa34"
    },
    {
      "path": "_tools/agent_os_capacity.py",
      "type": "file",
      "sha256": "8a4262c6f9468a5cfe118bb030ad5875870eb4ae1d9b6672e91e4307ecca3fb7"
    },
    {
      "path": "_tools/agent_os_cli.py",
      "type": "file",
      "sha256": "a16497975d64d9544f4a37b52a7642794c7d39580e94d9acdd244c724297517a"
    },
    {
      "path": "_tools/agent_os_clients.py",
      "type": "file",
      "sha256": "76a040da4d199043a307f72804e5ca6b2bd7eea2abf73ca62876f91786b1b7a0"
    },
    {
      "path": "_tools/agent_os_context_memory.py",
      "type": "file",
      "sha256": "728a640d60ffe47326bf20975ae32ef86e137490b7f6c4d7b3b25576d2300fc8"
    },
    {
      "path": "_tools/agent_os_continuity.py",
      "type": "file",
      "sha256": "0d61fc02fe7d5c071fcc0791c3e67644d6cf70feb4305966f4620764c528c5e2"
    },
    {
      "path": "_tools/agent_os_continuity_dependency_order.py",
      "type": "file",
      "sha256": "100a50fec3779e0e79e8874cd524ef21a2f87a8c3e1413b315d16780a0c70235"
    },
    {
      "path": "_tools/agent_os_continuity_migration_chain.py",
      "type": "file",
      "sha256": "f9d795333e844a99bb2ce9242fcb6badfc2e1a89202c7c8821f163ee347e25d6"
    },
    {
      "path": "_tools/agent_os_continuity_portability.py",
      "type": "file",
      "sha256": "81fe1444a2221377dbaf20939fd159745a11a7c2d6c504911d4cbeaa96b4b6b4"
    },
    {
      "path": "_tools/agent_os_continuity_portability_export.py",
      "type": "file",
      "sha256": "4e7bf4558a8610f83acd0f111edd4741c1f5239fde8ea328c0dde7d62cfd5ca6"
    },
    {
      "path": "_tools/agent_os_continuity_portability_foundation.py",
      "type": "file",
      "sha256": "a8c5f5914f0e95aef09b315d21957564af71b6a49586fbab31b2c0005479bd53"
    },
    {
      "path": "_tools/agent_os_continuity_portability_restore.py",
      "type": "file",
      "sha256": "97de4f4fc1d533d50b3a9e9405438903d92158058a22cd214c383fce97c31bd3"
    },
    {
      "path": "_tools/agent_os_continuity_portability_retention_archive.py",
      "type": "file",
      "sha256": "59ac81a10713e432b00d5e33c85bd89c3bd8384b4495d450aac025aba0aa6015"
    },
    {
      "path": "_tools/agent_os_continuity_transactions.py",
      "type": "file",
      "sha256": "5375aeffa5417a75da15838871e496120c0262d755acf6f7e590b8a3aa61aae9"
    },
    {
      "path": "_tools/agent_os_control_center.py",
      "type": "file",
      "sha256": "8cc6a09f6fc2aa7252d42a81149c32e5e4a46590a0444b52a92782b0302ee739"
    },
    {
      "path": "_tools/agent_os_domain.py",
      "type": "file",
      "sha256": "86137eb83567b97c79d6b80ed8636002fd74755b20ccc64495da9e2798c7e74c"
    },
    {
      "path": "_tools/agent_os_genesis.py",
      "type": "file",
      "sha256": "778ac62dd9a992d11ef610e1498dd83d179fb998be354c8404a96b24d9d2744c"
    },
    {
      "path": "_tools/agent_os_genesis_transactions.py",
      "type": "file",
      "sha256": "7ad6e83341ca7a7bdc40d052232b31d41cf760d3fd96a3f7dfbb3712e61f6037"
    },
    {
      "path": "_tools/agent_os_lifecycle.py",
      "type": "file",
      "sha256": "6b085de8f699f61ba27a2427073e100752882bfe66b362eca2b18fad86b60a89"
    },
    {
      "path": "_tools/agent_os_mcp_server.py",
      "type": "file",
      "sha256": "ae0df69cef5368903f5e2ef52e9c373e4b443ddacf45c44a693d405bebc93fe2"
    },
    {
      "path": "_tools/agent_os_migrate.py",
      "type": "file",
      "sha256": "63f49af47dd389ede73a8a37fd0e1030ecf61d0806cf79b39f5e298684d86360"
    },
    {
      "path": "_tools/agent_os_paths.py",
      "type": "file",
      "sha256": "5335716fd2ff1ca91a5ca6f5fc47edec733281bf6340499f022b17bf085eed3c"
    },
    {
      "path": "_tools/agent_os_publication.py",
      "type": "file",
      "sha256": "dfe27d5bcde829ea7e509008782af8600c2f93bc9c3ec6ae99888ccf932c1d8e"
    },
    {
      "path": "_tools/agent_os_research.py",
      "type": "file",
      "sha256": "50d617a8433ab97b29410115626532caa0ecbb07ad880e703de3e1b7b1ebd6ad"
    },
    {
      "path": "_tools/agent_os_resolver.py",
      "type": "file",
      "sha256": "77442cd46d5ebfdda30c4bef4623e91de42ca0765bbd62ebfeddb11c1ef501ce"
    },
    {
      "path": "_tools/agent_os_transaction_lock.py",
      "type": "file",
      "sha256": "119ca4f84198cc084e050a7c444eb89d6d4e4504eafdd366aa4cc88c45ee401d"
    },
    {
      "path": "_tools/agent_os_transactions.py",
      "type": "file",
      "sha256": "049d44cb17878fcfa5fa438677c65f0e6fbf9243d0df9fe27eb2a871d870c854"
    },
    {
      "path": "_tools/capability_lifecycle/candidate_validation.py",
      "type": "file",
      "sha256": "cfaee4db7ce26b76e131a9f54a35ed84ebffaa653a4024d247eee9b1d7f453e5"
    },
    {
      "path": "_tools/capability_lifecycle/integration_builder.py",
      "type": "file",
      "sha256": "431503887811620c99a0d3e822d61b05db4af1d403e254060840aa82472b9f4a"
    },
    {
      "path": "_tools/capability_lifecycle/manifest_builder.py",
      "type": "file",
      "sha256": "695873832e5dcf0b682cc49da37bfd6ec41257d7c8ea5fe5bd18597abe99b772"
    },
    {
      "path": "_tools/capability_lifecycle/platform_privacy.py",
      "type": "file",
      "sha256": "0055a569603a663d6cb15a3815871f95a068b917fa76d0bc3c19c2c08ba153d6"
    },
    {
      "path": "_tools/capability_lifecycle/shared.py",
      "type": "file",
      "sha256": "0fb8d7f2ebdddd843d9a22062581d7369998d96cb9ea254775c79424bc687ffc"
    },
    {
      "path": "_tools/capability_lifecycle/state_planning.py",
      "type": "file",
      "sha256": "261904fdcb789341898131e3d27df391215e7f32257c0c7fbff77223fb3a455e"
    },
    {
      "path": "_tools/capability_lifecycle/telemetry.py",
      "type": "file",
      "sha256": "98e959cda7223eaf4650701feb82a04ca0d6007263d07e30d2ac9add2b3bee34"
    },
    {
      "path": "_tools/capability_lifecycle/test_activation_snapshot_vendor.py",
      "type": "file",